{
  "schema_version": 1,
  "config_id": "golden-config",
  "iv": 31,
  "stat_point_max_per_stat": 32,
  "gender_policy": "unset",
  "nickname_policy": "none",
  "default_item_weight": 1,
  "item_weights": [
    {
      "item": "abomasite",
      "weight": 3
    },
    {
      "item": "absolite",
      "weight": 5
    }
  ],
  "d_max": 4000000,
  "pilot_draws": 40000,
  "pilot_min_hits": 20,
  "n_stratum_min": 2,
  "fill_quantile_permille": 990,
  "sealed_margin_permille": 200,
  "range_draws_log2": 20,
  "range_margin_permille": 100,
  "shard_rows_log2": 18,
  "two_platform_bound": 1000000,
  "sampled_ranges": 16,
  "proposal": {
    "kind": "mixture",
    "components": [
      {
        "kind": "role_sets",
        "role_set_table_hash": "bbbbbbbbbbbbbbbbbbbbbbbbbbbbbbbbbbbbbbbbbbbbbbbbbbbbbbbbbbbbbbbb",
        "share_permille": 200
      },
      {
        "kind": "uniform",
        "share_permille": 300
      },
      {
        "kind": "usage",
        "share_permille": 500,
        "usage_table_hash": "cccccccccccccccccccccccccccccccccccccccccccccccccccccccccccccccc",
        "species_root": 2,
        "set_root": 1,
        "floor_permille": 100
      }
    ],
    "gates": {
      "p2_min_accept_permille": 500,
      "p3_min_bits": 40,
      "p4_min_strata_permille": 750,
      "p1_min_usage_permille": 950,
      "p3_min_bits_usage": 16
    }
  }
}
